{
  "schema_version": "1.0.0",
  "tool_type": "router",
  "id": "animarouter",
  "name": "AnimaRouter",
  "description": "Lightweight routing gateway for free LLM APIs with multi-provider support, request caching, and automatic fallback.",
  "description_fa": "Gateway مسیریابی سبک برای APIهای رایگان LLM با پشتیبانی از چند Provider، کش درخواست و Fallback خودکار.",
  "repository": "https://github.com/animaios/animarouter",
  "deployment": {
    "type": "self_hosted",
    "instructions": "Docker deploy or manual setup",
    "instructions_fa": "استقرار با Docker یا راه‌اندازی دستی"
  },
  "auth_surface": {
    "type": "api_key",
    "credential_storage": "env_file",
    "notes_fa": "کلیدهای API در متغیرهای محیطی ذخیره می‌شوند."
  },
  "capabilities": {
    "openai_compatible": true,
    "anthropic_compatible": false,
    "supported_upstreams": [
      "OpenAI-compatible free APIs",
      "community provider endpoints"
    ],
    "features": ["load_balancing", "fallback", "model_discovery"]
  },
  "iran_compatibility": {
    "status": "unknown",
    "last_checked": "2026-07-16",
    "notes_fa": "تست زنده از ایران انجام نشده. کارایی بستگی به upstreamهای قابل دسترس از ایران دارد."
  },
  "risk": {
    "terms": "medium",
    "stability": "experimental",
    "credential_safety": "moderate",
    "notes_fa": "پروژه جدید. پایداری و پشتیبانی community محدود."
  },
  "verification": {
    "level": "code_reviewed",
    "last_checked": "2026-07-16",
    "checked_by": "upstream_monitor",
    "stale_after_days": 14
  },
  "upstream_repositories": [
    "https://github.com/animaios/animarouter"
  ]
}
