{
  "schema_version": "1.0.0",
  "tool_type": "session_bridge",
  "id": "cliproxyapi",
  "name": "CLIProxyAPI",
  "description": "OAuth/CLI bridge that uses provider CLI authentication to expose OpenAI-compatible endpoints locally.",
  "description_fa": "پل OAuth/CLI که از احراز هویت CLI Providerها برای ارائه Endpointهای سازگار با OpenAI به‌صورت محلی استفاده می‌کند.",
  "repository": "https://github.com/router-for-me/CLIProxyAPI",
  "deployment": {
    "type": "local",
    "instructions": "npm install -g cliproxyapi or clone",
    "instructions_fa": "npm install -g cliproxyapi یا clone مخزن"
  },
  "auth_surface": {
    "type": "oauth",
    "credential_storage": "config_file",
    "notes_fa": "از OAuth لاگین CLI Provider استفاده می‌کند. توکن در فایل کانفیگ محلی ذخیره می‌شود."
  },
  "capabilities": {
    "openai_compatible": true,
    "anthropic_compatible": true,
    "supported_upstreams": [
      "OpenAI",
      "Anthropic",
      "Google",
      "Groq",
      "other provider CLIs"
    ],
    "features": ["session_persistence"]
  },
  "iran_compatibility": {
    "status": "unknown",
    "last_checked": "2026-08-05",
    "notes_fa": "تست مستقیم از ایران انجام نشده است. امکان احراز هویت OAuth و دسترسی به Providerهای بالادستی باید با شواهد شبکه، حساب و سیاست رسمی جداگانه بررسی شود."
  },
  "risk": {
    "terms": "medium",
    "stability": "experimental",
    "credential_safety": "moderate",
    "notes_fa": "توکن OAuth در فایل محلی ذخیره می‌شود. ریسک کمتر از Cookie injection."
  },
  "verification": {
    "level": "code_reviewed",
    "last_checked": "2026-08-05",
    "checked_by": "upstream_monitor",
    "stale_after_days": 14
  },
  "upstream_repositories": [
    "https://github.com/router-for-me/CLIProxyAPI"
  ]
}
